case_id,eligible,reason,job_id,absolute_odb_path,file_size_bytes,sha256,notch_length_mm,lc_mm,physical_elements,layered_elements,source_class
H0,false,accepted lc015 H0 exact single-notch RF-U source but ineligible for D3A because ALLIE/ALLSE/ALLWK energy history is absent,1376154.mmaster02,/scratch/pr21vyci/adaptive-remeshing/runs/molnar_lc015_h0_exact_1376154.mmaster02/molnar_lc015_h0_exact.odb,88827548,01601effd2a110dc7124356cb3d9baf6d772d55f4fb344414ad219ba9b78e07b,0.5,0.015,3930,11790,molnar_lc015_h_convergence
H1,false,H1 is not the requested H0 diagnostic source,1376185.mmaster02,/scratch/pr21vyci/adaptive-remeshing/runs/molnar_lc015_h1_h0025_1376185.mmaster02/molnar_lc015_h1_h0025.odb,244467576,4898164c4205b0fb957e68cdefc0eba43bdb2fcf74175b6211ae09391131b6c3,0.5,0.015,12064,36192,molnar_lc015_h_convergence
H2-PUB,false,H2-PUB is the fine validation reference not the H0 diagnostic source,1376186.mmaster02,/scratch/pr21vyci/adaptive-remeshing/runs/molnar_lc015_h2_pub_h0010_1376186.mmaster02/molnar_lc015_h2_pub_h0010.odb,660842080,9c3755b3359a6aa61f4de8a8358bffd489da8cbd2ac45ba4f9c8c9f2922fa825,0.5,0.015,33852,101556,molnar_lc015_h_convergence
T5_H0_smoke,false,T5 smoke uses 0.45 mm notch and elastic automation probe,1376758.mmaster02,/scratch/pr21vyci/adaptive-remeshing/runs/molnar_h0_notch045_elastic_probe_1376758.mmaster02/molnar_h0_notch045_elastic_probe.odb,504032,,0.45,,,"",automation_smoke_not_fracture_source
C2A_aux,false,C2A auxiliary continuum/MISERI ODB is not the accepted fracture H0 source,1376298.mmaster02,/scratch/pr21vyci/adaptive-remeshing/runs/molnar_h0_aux_miseseri_1376298.mmaster02/molnar_h0_aux_miseseri.odb,8491476,,,,,c2_auxiliary_not_fracture_source
